{
    "$schema": "https://solobase.dev/schemas/solobase.json",
    "version": 0,
    "app": "shipfast",
    "listen": "0.0.0.0:8091",
    "database": { "type": "sqlite", "path": "data/dropship.db" },
    "storage": { "type": "local", "root": "data/storage" },
    "jwt_secret": "${JWT_SECRET}",
    "web_root": "site",
    "features": {
        "auth": {},
        "products": {},
        "files": {},
        "legalpages": {}
    }
}
