{
    "$schema": "https://solobase.dev/schemas/solobase.json",
    "version": 0,
    "app": "solobase-e2e",
    "listen": "0.0.0.0:8090",
    "database": { "type": "sqlite", "path": "data/solobase.db" },
    "storage": { "type": "local", "root": "data/storage" },
    "jwt_secret": "${JWT_SECRET}",
    "web_root": "./frontend/build",
    "features": {
        "auth": {},
        "admin": {},
        "products": {},
        "legalpages": {}
    }
}
